{
    "id": "cambiar-aceite",
    "slug": "cambiar-aceite",
    "category": "maintenance",
    "author": "CarSpecio Technical Team",
    "publishedAt": "2026-06-20",
    "updatedAt": "2026-06-28",
    "heroImage": "../../images/placeholder.svg",
    "readingTime": 10,
    "difficulty": "beginner",
    "status": "active",
    "content": {
        "es": {
            "title": "Cómo cambiar el aceite del coche paso a paso",
            "excerpt": "Guía completa con pasos detallados, herramientas necesarias y consejos profesionales para cambiar el aceite del motor en casa y ahorrar dinero.",
            "intro": "Cambiar el aceite del motor es la operación de mantenimiento más importante que puedes hacer por tu coche. Un aceite limpio reduce la fricción, enfría el motor, arrastra las impurezas y puede aumentar la vida útil del motor hasta un 40%. Este proceso tarda unos 30–45 minutos y puede ahorrarte entre 40 € y 120 € por visita al taller.",
            "keyTakeaways": [
                "El aceite sucio puede aumentar el consumo de combustible hasta un 2%",
                "Cambiar el filtro de aceite en cada sustitución es obligatorio",
                "La viscosidad correcta (p.ej. 5W-30) está en el manual del vehículo",
                "Nunca mezcles aceites de distintas viscosidades o bases",
                "El aceite usado es residuo tóxico: llévalo a un punto limpio"
            ],
            "sections": [
                {
                    "id": "cuando-cambiar",
                    "title": "¿Cuándo debo cambiar el aceite?",
                    "content": "<p>La mayoría de fabricantes modernos recomiendan cambiar el aceite <strong>cada 10.000–15.000 km</strong> o una vez al año, lo que ocurra primero. Sin embargo, si conduces en condiciones severas (ciudad, mucho frío, remolque de cargas), el intervalo baja a <strong>5.000–7.500 km</strong>.</p><p>Señales de que necesitas cambio urgente:</p><ul><li>Nivel por debajo del mínimo en la varilla</li><li>Aceite negro y espeso (sano: ámbar o marrón claro)</li><li>Luz de aceite encendida en el cuadro</li><li>Ruido de traqueteo al arrancar en frío</li><li>Olor a quemado en el habitáculo</li></ul>",
                    "callout": {
                        "type": "tip",
                        "text": "Consulta siempre el manual del propietario. Algunos vehículos modernos con aceite sintético pueden llegar a 20.000 km, pero nunca superes los 2 años sin cambiar."
                    }
                },
                {
                    "id": "herramientas",
                    "title": "Herramientas y materiales necesarios",
                    "content": "<p>Antes de empezar, ten a mano todo esto para no interrumpir el proceso:</p><ul><li><strong>Aceite nuevo</strong> — Litros según el manual (normalmente 4–6 L). Elige la viscosidad correcta: 5W-30, 5W-40, 0W-20, etc.</li><li><strong>Filtro de aceite nuevo</strong> — Usa siempre uno de calidad (Mann, Bosch, Mahle). Un filtro barato puede fallar en días.</li><li><strong>Llave de cubo</strong> — Para el tapón de drenaje (generalmente 14, 17 o 19 mm).</li><li><strong>Llave de filtros</strong> — Ajustable o específica para tu motor.</li><li><strong>Gato hidráulico + caballetes de seguridad</strong> — Nunca trabajes bajo el coche apoyado solo en el gato.</li><li><strong>Bandeja de recogida</strong> — Capacidad mínima de 8 litros.</li><li><strong>Embudo, trapos, guantes de nitrilo</strong></li><li><strong>Arandela de cobre nueva</strong> — Para el tapón de drenaje (coste: ~0,50 €, ahorra fugas).</li></ul>",
                    "callout": {
                        "type": "warning",
                        "text": "Nunca uses gatos de tijera de fábrica para trabajar debajo del coche. Son solo para cambiar una rueda en la carretera. Usa siempre caballetes homologados."
                    }
                },
                {
                    "id": "elegir-aceite",
                    "title": "Cómo elegir el aceite correcto",
                    "content": "<p>Usar el aceite equivocado puede dañar el motor gravemente. Aquí el criterio:</p><ul><li><strong>Viscosidad</strong>: El código SAE (5W-30, 0W-40…) lo elige el fabricante. No lo cambies caprichosamente.</li><li><strong>Base</strong>: Mineral (más barato, para motores viejos), semisintético (equilibrado) o sintético (máxima protección, motores modernos).</li><li><strong>Especificación</strong>: Busca la norma ACEA (A3/B4, C3…) y la aprobación del fabricante (VW 504.00, BMW LL-04, Dexos…).</li></ul><p>Marcas fiables: Castrol Edge, Mobil 1, Liqui Moly, Shell Helix Ultra, Total Quartz. El precio importa: un buen sintético ronda los 7–15 €/litro.</p>",
                    "callout": {
                        "type": "tip",
                        "text": "Si tu coche tiene Aviso de Mantenimiento Variable (BMW Condition Based Service, Mercedes ASSYST, etc.), resetea el contador del aceite después del cambio. Consulta el manual de usuario para el procedimiento exacto."
                    }
                },
                {
                    "id": "preparacion",
                    "title": "Preparación del vehículo",
                    "content": "<p>Sigue este orden exacto para no olvidar nada:</p><ol><li>Conduce el coche <strong>5–10 minutos</strong> para calentar el aceite a ~60°C — fluirá mejor y arrastrará más sedimentos. No lo calientes hasta el máximo operativo o quemarás tus manos.</li><li>Aparca en superficie plana y firme.</li><li>Apaga el motor y espera <strong>5 minutos</strong>.</li><li>Acciona el <strong>freno de mano</strong> y coloca cuñas en las ruedas traseras.</li><li>Abre el capó y <strong>retira la tapa del aceite</strong> del motor para facilitar el drenaje (crea vacío de otro modo).</li><li>Eleva el coche con el gato hidráulico por los puntos de elevación marcados en el umbral y coloca los <strong>caballetes de seguridad</strong>.</li></ol>"
                },
                {
                    "id": "drenaje",
                    "title": "Drenar el aceite viejo",
                    "content": "<p>Esta es la fase más importante y la que más tiempo requiere:</p><ol><li>Coloca la bandeja de recogida bajo el cárter del motor.</li><li>Localiza el <strong>tapón de drenaje</strong> (parte inferior del cárter, generalmente apuntando hacia abajo o hacia un lateral).</li><li>Afloja el tapón con la llave de cubo girando <strong>en sentido antihorario</strong>. Hazlo despacio al final con los dedos para no perder el tapón en el aceite.</li><li>Deja drenar durante <strong>10–15 minutos</strong>. No en 2 minutos — el aceite viscoso necesita tiempo.</li><li>Observa el chorro: si sale con mucha espuma puede haber refrigerante mezclado (problema serio). Si es muy negro y hay partículas metálicas, el motor está desgastado.</li><li>Limpia la zona del tapón con un trapo.</li></ol>",
                    "callout": {
                        "type": "warning",
                        "text": "El aceite caliente puede causar quemaduras graves. Usa siempre guantes de nitrilo resistentes al calor y gafas de protección. Si el aceite sale disparado, aparta la cara."
                    }
                },
                {
                    "id": "filtro",
                    "title": "Cambiar el filtro de aceite",
                    "content": "<p>El filtro retiene partículas metálicas, carbonilla y contaminantes. Nunca lo reutilices:</p><ol><li>Localiza el filtro. Puede ser de tipo <strong>cartucho</strong> (carcasa plástica con filtro interno) o tipo <strong>rosca</strong> (lata metálica roscada directamente).</li><li>Usa la llave de filtros para girarlo <strong>en sentido antihorario</strong>. Si está muy apretado, pon un trapo para mejor agarre.</li><li>Vacía el aceite del filtro viejo en la bandeja. Limpia perfectamente la superficie de asiento del filtro en el motor.</li><li><strong>Humedece la junta de goma del filtro nuevo</strong> con aceite limpio — esto garantiza el sellado correcto y evita que la junta se pegue.</li><li>Enrosca el nuevo filtro a mano hasta que la junta toque la superficie, luego aprieta <strong>3/4 de vuelta más</strong>. NO uses herramienta para apretar — se deformará la junta.</li></ol>",
                    "callout": {
                        "type": "tip",
                        "text": "Si tu coche usa filtro de cartucho (BMW, Mercedes, Audi TDI…), compra también la junta tórica de repuesto de la carcasa. Reutilizarla puede causar fugas."
                    }
                },
                {
                    "id": "relleno",
                    "title": "Rellenar con aceite nuevo y verificar",
                    "content": "<p>La fase final antes de arrancar:</p><ol><li>Vuelve a colocar el tapón de drenaje con una <strong>arandela de cobre nueva</strong> y apriétalo al par correcto (normalmente 20–30 Nm — consulta el manual).</li><li>Baja el coche de los caballetes.</li><li>Con el embudo, vierte el <strong>80% de la cantidad total</strong> de aceite indicada en el manual (por ejemplo, si son 5 litros, echa 4 primero).</li><li>Vuelve a colocar la tapa del aceite, arranca el motor y déjalo correr <strong>30 segundos</strong> con el motor al ralentí. Comprueba que no haya fugas bajo el coche.</li><li>Apaga el motor, espera <strong>3 minutos</strong> para que el aceite baje al cárter.</li><li>Comprueba el nivel con la varilla: sácala, límpiala, introdúcela, sácala. El nivel debe estar entre el mínimo y el máximo, <strong>idealmente en el tercio superior</strong>.</li><li>Si es necesario, añade aceite poco a poco hasta alcanzar el nivel correcto.</li></ol>",
                    "callout": {
                        "type": "warning",
                        "text": "Excederse del nivel máximo es tan peligroso como quedarse corto. El aceite de más puede ser aspirado por el sistema de ventilación del cárter, contaminar el catalizador y dañar sellos de aceite."
                    }
                },